{
  "schemaVersion": 1,
  "bankVersion": "diagnostic-v1-bank.2.0.0-candidate",
  "status": "CANDIDATE_NOT_APPROVED",
  "purpose": "Historical evidence only; excluded from54+4 candidate totals and never eligible by association",
  "sourceSha256": "ab86b83eddba5bc3e1e2601c8b5e49ca6694753a1eea5c358389e82531a25da0",
  "items": [
    {
      "auditItemId": "G1",
      "existingQuestionId": "G1",
      "sectionId": "grammar",
      "domain": "Grammar",
      "sourceLocation": "src/data.ts:8:5",
      "questionType": "SINGLE_CHOICE",
      "responseMode": "One radio option; saved zero-based numeric index",
      "wording": "Choose the correct sentence:",
      "instructions": "Choose one answer to continue. No separate per-item instruction field; ActivityRenderer single_choice in test mode.",
      "optionsJSON": "[{\"displayLetter\":\"A\",\"existingOptionId\":null,\"legacyIndex\":0,\"text\":\"She go to university every day.\"},{\"displayLetter\":\"B\",\"existingOptionId\":null,\"legacyIndex\":1,\"text\":\"She goes to university every day.\"},{\"displayLetter\":\"C\",\"existingOptionId\":null,\"legacyIndex\":2,\"text\":\"She going to university every day.\"},{\"displayLetter\":\"D\",\"existingOptionId\":null,\"legacyIndex\":3,\"text\":\"She gone to university every day.\"}]",
      "existingKeyIndex": "1",
      "existingKeyLetter": "B",
      "existingKeyText": "She goes to university every day.",
      "existingOptionIdentity": "NONE; position index and UI letter only",
      "scoring": "Exact numeric equality with answer index; correct=1 else0; current section denominator includes all original items",
      "normalization": "None; string numbers, case changes or option labels are not normalized by diagnostic service",
      "stimulus": "None beyond item text",
      "difficultyLabel": "NONE; skill is a topic label, not calibrated difficulty",
      "skillLabel": "Grammar basics",
      "provenance": "Reviewer linguistic analysis",
      "usageRights": "UNKNOWN: local source exists; no item-level author, grant/license or provenance ledger found. No official IELTS/authentic-paper claim established.",
      "contentFinding": "B is the only standard complete present-simple sentence: singular subject agrees with goes. Other options lack agreement or auxiliary. Generic stem repeats G5, but options/construct differ; not a duplicated complete item.",
      "contentEligibility": "SUPPORTED_CANDIDATE",
      "validatedReleaseEligibility": "NO: owner-approved immutable source/key freeze and provenance unresolved",
      "clarificationOrCorrection": "Retain subject to source/rights and owner freeze."
    },
    {
      "auditItemId": "G2",
      "existingQuestionId": "G2",
      "sectionId": "grammar",
      "domain": "Grammar",
      "sourceLocation": "src/data.ts:9:5",
      "questionType": "SINGLE_CHOICE",
      "responseMode": "One radio option; saved zero-based numeric index",
      "wording": "I ______ English for three years.",
      "instructions": "Choose one answer to continue. No separate per-item instruction field; ActivityRenderer single_choice in test mode.",
      "optionsJSON": "[{\"displayLetter\":\"A\",\"existingOptionId\":null,\"legacyIndex\":0,\"text\":\"study\"},{\"displayLetter\":\"B\",\"existingOptionId\":null,\"legacyIndex\":1,\"text\":\"studied\"},{\"displayLetter\":\"C\",\"existingOptionId\":null,\"legacyIndex\":2,\"text\":\"have studied\"},{\"displayLetter\":\"D\",\"existingOptionId\":null,\"legacyIndex\":3,\"text\":\"am studied\"}]",
      "existingKeyIndex": "2",
      "existingKeyLetter": "C",
      "existingKeyText": "have studied",
      "existingOptionIdentity": "NONE; position index and UI letter only",
      "scoring": "Exact numeric equality with answer index; correct=1 else0; current section denominator includes all original items",
      "normalization": "None; string numbers, case changes or option labels are not normalized by diagnostic service",
      "stimulus": "None beyond item text",
      "difficultyLabel": "NONE; skill is a topic label, not calibrated difficulty",
      "skillLabel": "Present perfect",
      "provenance": "https://dictionary.cambridge.org/uk/grammar/british-grammar/past-simple-or-present-perfect.",
      "usageRights": "UNKNOWN: local source exists; no item-level author, grant/license or provenance ledger found. No official IELTS/authentic-paper claim established.",
      "contentFinding": "C supports an up-to-now interpretation, but B is grammatical for a completed three-year period. No time context fixes the intended reading.",
      "contentEligibility": "DISPUTED",
      "validatedReleaseEligibility": "NO: owner-approved immutable source/key freeze and provenance unresolved",
      "clarificationOrCorrection": "Proposed only: specify continuing study up to now and review all distractors; approve revised immutable version before scoring."
    },
    {
      "auditItemId": "G3",
      "existingQuestionId": "G3",
      "sectionId": "grammar",
      "domain": "Grammar",
      "sourceLocation": "src/data.ts:10:5",
      "questionType": "SINGLE_CHOICE",
      "responseMode": "One radio option; saved zero-based numeric index",
      "wording": "If I ______ more time, I would learn another language.",
      "instructions": "Choose one answer to continue. No separate per-item instruction field; ActivityRenderer single_choice in test mode.",
      "optionsJSON": "[{\"displayLetter\":\"A\",\"existingOptionId\":null,\"legacyIndex\":0,\"text\":\"have\"},{\"displayLetter\":\"B\",\"existingOptionId\":null,\"legacyIndex\":1,\"text\":\"had\"},{\"displayLetter\":\"C\",\"existingOptionId\":null,\"legacyIndex\":2,\"text\":\"will have\"},{\"displayLetter\":\"D\",\"existingOptionId\":null,\"legacyIndex\":3,\"text\":\"would have\"}]",
      "existingKeyIndex": "1",
      "existingKeyLetter": "B",
      "existingKeyText": "had",
      "existingOptionIdentity": "NONE; position index and UI letter only",
      "scoring": "Exact numeric equality with answer index; correct=1 else0; current section denominator includes all original items",
      "normalization": "None; string numbers, case changes or option labels are not normalized by diagnostic service",
      "stimulus": "None beyond item text",
      "difficultyLabel": "NONE; skill is a topic label, not calibrated difficulty",
      "skillLabel": "Conditionals",
      "provenance": "https://learnenglish.britishcouncil.org/free-resources/grammar/b1-b2/conditionals-zero-first-second",
      "usageRights": "UNKNOWN: local source exists; no item-level author, grant/license or provenance ledger found. No official IELTS/authentic-paper claim established.",
      "contentFinding": "B is the conventional second-conditional past form with would learn; A/C/D do not form the intended standard conditional.",
      "contentEligibility": "SUPPORTED_CANDIDATE",
      "validatedReleaseEligibility": "NO: owner-approved immutable source/key freeze and provenance unresolved",
      "clarificationOrCorrection": "Retain; no calibrated difficulty claim."
    },
    {
      "auditItemId": "G4",
      "existingQuestionId": "G4",
      "sectionId": "grammar",
      "domain": "Grammar",
      "sourceLocation": "src/data.ts:11:5",
      "questionType": "SINGLE_CHOICE",
      "responseMode": "One radio option; saved zero-based numeric index",
      "wording": "By the time we arrived, the lecture ______.",
      "instructions": "Choose one answer to continue. No separate per-item instruction field; ActivityRenderer single_choice in test mode.",
      "optionsJSON": "[{\"displayLetter\":\"A\",\"existingOptionId\":null,\"legacyIndex\":0,\"text\":\"starts\"},{\"displayLetter\":\"B\",\"existingOptionId\":null,\"legacyIndex\":1,\"text\":\"has started\"},{\"displayLetter\":\"C\",\"existingOptionId\":null,\"legacyIndex\":2,\"text\":\"had started\"},{\"displayLetter\":\"D\",\"existingOptionId\":null,\"legacyIndex\":3,\"text\":\"starting\"}]",
      "existingKeyIndex": "2",
      "existingKeyLetter": "C",
      "existingKeyText": "had started",
      "existingOptionIdentity": "NONE; position index and UI letter only",
      "scoring": "Exact numeric equality with answer index; correct=1 else0; current section denominator includes all original items",
      "normalization": "None; string numbers, case changes or option labels are not normalized by diagnostic service",
      "stimulus": "None beyond item text",
      "difficultyLabel": "NONE; skill is a topic label, not calibrated difficulty",
      "skillLabel": "Past perfect",
      "provenance": "Reviewer tense-sequence analysis",
      "usageRights": "UNKNOWN: local source exists; no item-level author, grant/license or provenance ledger found. No official IELTS/authentic-paper claim established.",
      "contentFinding": "C establishes the lecture starting before the past arrival. A/B have unsuitable tense anchoring; D lacks a finite verb.",
      "contentEligibility": "SUPPORTED_CANDIDATE",
      "validatedReleaseEligibility": "NO: owner-approved immutable source/key freeze and provenance unresolved",
      "clarificationOrCorrection": "Retain subject to freeze."
    },
    {
      "auditItemId": "G5",
      "existingQuestionId": "G5",
      "sectionId": "grammar",
      "domain": "Grammar",
      "sourceLocation": "src/data.ts:12:5",
      "questionType": "SINGLE_CHOICE",
      "responseMode": "One radio option; saved zero-based numeric index",
      "wording": "Choose the correct sentence:",
      "instructions": "Choose one answer to continue. No separate per-item instruction field; ActivityRenderer single_choice in test mode.",